{
  "schemaVersion": "1.0",
  "repository": "tai0huynh-ux/tool-codex-gpt",
  "branch": "main",
  "headCommit": "HEAD",
  "lastPushedCommit": "origin/main",
  "currentPhase": "Live Vertical Slice In Progress",
  "currentTaskId": "P18-PILOT-001",
  "status": "in_progress",
  "lastCheckpoint": {
    "id": "P18-PILOT-001",
    "commit": "STATE_FILE_COMMIT",
    "completedAt": "2026-07-19T10:25:00.000Z"
  },
  "verifiedCommands": [
    "pnpm.cmd run verify",
    "pnpm.cmd migrations:check",
    "pnpm.cmd exec vitest run tests/continuity/state-schema.test.ts",
    "pnpm.cmd status -- --json",
    "skill-creator quick_validate.py for both project skills",
    "GitHub Actions Verify run 29641649890 reproduced the clean-checkout source-resolution failure",
    "Targeted response-router lint, type-check, and 6 tests after the source-alias fix",
    "GitHub Actions Verify run 29641802598 passed for CI fix 86a3360",
    "Desktop workflow IPC and renderer targeted tests: 12 passed",
    "GitHub Actions Verify run 29642191174 passed for P13 checkpoint 4103e7e",
    "pnpm.cmd run test:workflow-e2e: 2 recoverable fixture tests passed",
    "GitHub Actions Verify run 29642485845 passed for P14 checkpoint 184b84f",
    "Workflow IPC security and recoverable fixture targeted tests: 5 passed",
    "GitHub Actions Verify run 29643141058 passed for P16 checkpoint 77a495b",
    "Windows NSIS install, clean-profile launch, and silent uninstall smoke passed",
    "P6-IPC-002 full verification passed with 145 Vitest tests and a two-entry extension build",
    "GitHub Actions Verify run 29643866680 reproduced a missing Vite fixture source alias",
    "Extension type-check, two workflow E2E, two Chromium E2E, and two-entry build passed after restoring the dev-server alias",
    "Project renderer visual smoke at 1440x1000 and 390x844",
    "P6-IPC-003 targeted local relay, desktop named-pipe, and installer identity tests passed",
    "pnpm.cmd run verify passed with 153 Vitest tests, two workflow E2E tests, two Chromium E2E tests, and 15 workspace builds",
    "pnpm.cmd run package:win and pnpm.cmd run smoke:packaged:win passed",
    "pnpm.cmd run smoke:installed-native-host:win passed with two relay runs, six registry checks, and uninstall cleanup",
    "GitHub Actions Verify run 29645472474 passed clean-checkout Linux verification in 1m47s for P6-IPC-003",
    "P3-CODEX-001 production adapter tests passed with 12 ordered lifecycle, resume, cancellation, failure-redaction, and disposal cases",
    "pnpm.cmd run verify passed with 159 Vitest tests, two workflow E2E tests, two Chromium E2E tests, and 15 workspace builds",
    "pnpm.cmd run test:codex-spike passed live start, lifecycle, read-only sandbox, resume, cancellation, and failure mapping",
    "P6-IPC-004A targeted manifest, native bridge, operation executor, desktop relay, and installed ChatGPT harness tests passed: 16 tests",
    "pnpm.cmd run verify passed with 162 Vitest tests, two workflow E2E tests, two Chromium E2E tests, and 15 workspace builds",
    "pnpm.cmd run package:win and pnpm.cmd run smoke:packaged:win passed with nativeMessaging permission active",
    "pnpm.cmd run smoke:installed-native-host:win passed with two relay runs, six registry checks, and uninstall cleanup",
    "P6-IPC-005 targeted extension capture, routing, wake recovery, native bridge, and smoke-harness tests passed",
    "pnpm.cmd run verify passed with 164 Vitest tests, two workflow E2E tests, two Chromium E2E tests, and 15 workspace builds",
    "pnpm.cmd run smoke:installed-chatgpt:win passed live Edge health, zero-message new-chat capture hash, no-submit insertion, and exact cleanup",
    "GitHub Actions Verify run 29653888516 passed for P6-IPC-005",
    "GitHub Actions Verify run 29653971791 passed for published continuity checkpoint",
    "pnpm.cmd run verify passed with 165 Vitest tests, two workflow E2E tests, two Chromium E2E tests, and 15 workspace builds",
    "pnpm.cmd run test:internal-beta-uat passed 43 targeted tests and two Chromium fixture flows",
    "pnpm.cmd run package:win restored the Node SQLite ABI after Electron packaging",
    "pnpm.cmd run smoke:packaged:win passed packaged desktop and native-host readiness",
    "Installed native-host relay passed three non-destructive runs",
    "artifacts/internal-beta manifest and SHA-256 list generated; live Edge and clean install intentionally not rerun",
    "Packaged Computer Use observed rendered UI instead of white screen",
    "Packaged live UI acceptance recorded 12 controls and 7 of 7 checks passed",
    "pnpm.cmd run verify passed with 169 Vitest tests, two workflow E2E, two Chromium E2E, and 15 workspace builds",
    "pnpm.cmd run test:internal-beta-uat passed 43 targeted tests and two Chromium flows",
    "pnpm.cmd run package:win and pnpm.cmd run smoke:packaged:win passed after preload.cjs parity fix",
    "P18 ChatGPT submit targeted regression set passed 46 tests, including concurrent effect idempotency and deterministic rejection retry",
    "P18 Codex profile targeted adapter and response-router tests passed 31 cases, including root/fingerprint/profile fail-closed checks",
    "P18 pilot checkpoint passed 191 Vitest tests, 2 workflow fixture E2E tests, 2 Chromium fixture E2E tests, all workspace builds, shared strict contracts, website verifier, sandboxed preview boundary, and the full project-pilot fixture",
    "P18 packaged restart checkpoint passed 195 Vitest tests, 2 workflow fixture E2E tests, 2 Chromium fixture E2E tests, 46-test internal-beta UAT, live read-only Codex spike, all workspace builds, Windows packaging, packaged smoke, and fixture-only packaged close/reopen recovery with zero renderer runtime errors",
    "P18 current-conversation checkpoint passed 197 Vitest tests, 2 workflow fixture E2E tests, 2 Chromium fixture E2E tests, Windows packaging, packaged smoke, packaged restart acceptance, installed ChatGPT no-submit readiness, and preparation of an unsent reviewed live payload",
    "P18 startup recovery checkpoint passed 36 targeted recovery/extension/contract/pilot tests, isolated Windows packaging, packaged/native-host smoke, artifact hash synchronization, workspace packaged smoke, and real app-data renderer confirmation-required recovery for pilot 8ec5d3b7 without resend",
    "pnpm.cmd run verify passed with migration parity, formatting, lint, strict type-check, 206 Vitest tests, 2 workflow fixture E2E tests, 2 Chromium fixture E2E tests, and all 15 workspace builds",
    "Chat history archive MVP passed 214 Vitest tests, 2 workflow fixture E2E tests, 2 Chromium fixture E2E tests, 46-test internal-beta UAT, all workspace builds, Windows packaging, packaged/native-host smoke, and fixture-only packaged restart acceptance",
    "Canonical ChatGPT destination recovery passed 219 Vitest tests, 2 workflow fixture E2E tests, 2 Chromium fixture E2E tests, 46-test internal-beta UAT, all workspace builds, Windows packaging, packaged/native-host smoke, and fixture-only packaged restart acceptance",
    "Multi-connection catalog and safe ZIP checkpoint passed 228 Vitest tests, 2 workflow fixture E2E tests, 2 Chromium fixture E2E tests, 46-test internal-beta UAT, all workspace builds, Windows packaging, packaged ZIP-runtime and native-host smoke, and fixture-only packaged restart acceptance",
    "Installed native-host smoke was intentionally not rerun because an existing user Registry64 registration was detected and the non-destructive gate stopped before modification",
    "Redirect-loop and Codex local catalog targeted recovery/IPC/renderer suite passed 30 tests",
    "Codex local catalog reads only bounded allowlisted metadata and imports validated Git roots without manual project entry"
  ],
  "knownFailures": [],
  "activeBlockers": [],
  "nextActions": [
    "Obtain action-time user confirmation for reviewed ChatGPT payload 75cae5042832…428bae39.",
    "After confirmation, submit exactly once and require rendered acknowledgement plus a valid structured response.",
    "Stop again for the separate repository-bound Codex workspace-write approval before any file changes.",
    "Keep ZIP attachment explicit until a separate safe production browser file-upload boundary is implemented and accepted.",
    "Publish the redirect-loop and automatic Codex project discovery checkpoint after full verification and packaged gates."
  ],
  "workingTreeExpectedClean": true,
  "updatedAt": "2026-07-20T01:54:48.854+07:00"
}
